"_id","departments","evaluation","followers","img_url","intro","name","phone_number","position","reservation","special","url"
"6711fce15f4a555c8ce3c9fc","内科,外科,口腔科,肿瘤科,麻醉科,康复医学科,医学影像科,急诊医学科,病理科,医学检验科","7037","394","https://kano.guahao.com/hlarge_2D72956837.jpg","简介：空军军医大学口腔医院，暨第四军医大学口腔医学院，位于古城西安，是中国人民解放军唯一一所集教、医、研为一体的高等口腔专业学院，...更多","空军军医大学(第四军医大学)口腔医学院","029-84776225","陕西省西安市长乐西路145号","3","None","https://www.guahao.com/hospital/986d00e6-c720-11e1-913c-5cf9dd2e7135000"
"6711fce25f4a555c8ce3c9fe","内科,外科,儿科,肿瘤科,中医科,中西医结合科,麻醉科,疼痛科,医学影像科,急诊医学科,病理科,护理门诊,重症医学科","3.8万","1.2万","https://kano.guahao.com/hlarge_Cxg2954919.jpg","简介：上海市胸科医院是国内最早成立的以诊治心胸疾患为主的三级甲等专科医院。医院地处上海市西南中心淮海西路上，于1957年被卫生部指...更多","上海交通大学附属胸科医院","000000","上海市徐汇区淮海西路241号","82.0万","胸外科","https://www.guahao.com/hospital/8db18b07-5a05-4b8b-9183-30622b8e9da3000"
"6711fce45f4a555c8ce3ca00","院士门诊,普通门诊,专科门诊,正高专家门诊,副高专家门诊,产科建大卡,特需门诊A,特需门诊B,周末门诊A,周末门诊B,特需会诊A,特需门诊,外科,妇产科,儿科,男科,中医科,不孕不育科,医学影像科,全科医疗科","16.1万","4.1万","https://kano.guahao.com/hlarge_SoZ2953452.jpg","简介：复旦大学附属妇产科医院，由中国首家妇产专科医院——西门妇孺医院发展而来，是美国人Margaret Williamson于18...更多","复旦大学附属妇产科医院黄浦院区","021-33189900","上海市黄浦区方斜路566号","258.8万","None","https://www.guahao.com/hospital/125336131920301000"
"6711fce65f4a555c8ce3ca02","普通门诊,专科门诊,正高专家门诊,产科建大卡,优秀团队,副高专家门诊,周末特需门诊A,周末特需门诊B,特需门诊A,特需门诊B,特需会诊A,外科,妇产科,儿科,不孕不育科","17.2万","2.8万","https://kano.guahao.com/hlarge_i422953459.jpg","简介：复旦大学附属妇产科医院，由中国首家妇产专科医院——西门妇孺医院发展而来，是美国人Margaret Williamson于18...更多","复旦大学附属妇产科医院杨浦院区","021-33189900","上海市杨浦区沈阳路128号","205.2万","None","https://www.guahao.com/hospital/126811834070259000"
"6711fce75f4a555c8ce3ca04","内科,儿科,眼科,口腔科,急诊医学科,营养科","1.3万","1329","https://kano.guahao.com/hlarge_0HT2955602.jpg?timestamp=1534234424125","简介：中国医学科学院北京协和医学院血液学研究所血液病医院创建于1957年，创办人为著名血液学家、教育家邓家栋教授，其前身是中国人民...更多","中国医学科学院血液病医院（血液学研究所）","022-23909999","天津市和平区南京路288号","3.0万","None","https://www.guahao.com/hospital/98684eaf-c720-11e1-913c-5cf9dd2e7135000"
"6711fce95f4a555c8ce3ca06","内科,外科,骨科,妇产科,儿科,皮肤性病科,眼科,耳鼻咽喉头颈科,口腔科,肿瘤科,中医科,不孕不育科,精神科,麻醉科,疼痛科,康复医学科,医学影像科,全科医疗科,急诊医学科,体检科,医学检验科,护理门诊,营养科","2.3万","2406","https://kano.guahao.com/hlarge_VTW2956895.jpg","简介：重庆医科大学附属第一医院于1957年由原上海第一医学院（现复旦大学附属医院）分迁来渝创建，历经50余年的建设和发展，已成为全...更多","重庆医科大学附属第一医院","023-68811360","重庆市渝中区袁家岗友谊路1号","12.7万","胃肠外科","https://www.guahao.com/hospital/986d41c1-c720-11e1-913c-5cf9dd2e7135000"
"6711fcea5f4a555c8ce3ca08","内科,外科,妇产科,儿科,眼科,口腔科,中医科,中西医结合科,精神科,麻醉科,康复医学科,医学影像科,体检科,护理门诊,营养科","4671","901","https://kano.guahao.com/hlarge_gA32958429.jpg","简介：浙江大学医学院附属儿童医院是浙江省最大的三级甲等儿童医院，承担着全省儿科医疗、教学、科研、儿童保健及突发性公共卫生事件应急任...更多","浙江大学医学院附属儿童医院(湖滨院区)","0571-87061007","浙江省杭州市下城区竹竿巷57号310003","179","发育行为儿科","https://www.guahao.com/hospital/ED25EA3F3F66A102E040A8C00F01221B000"
"6711fcec5f4a555c8ce3ca0a","内科,外科,骨科,妇产科,儿科,皮肤性病科,男科,眼科,耳鼻咽喉头颈科,口腔科,肿瘤科,中医科,精神科,麻醉科,康复医学科,运动医学科,医学影像科,全科医疗科,急诊医学科,病理科,护理门诊,营养科","6.7万","1.7万","https://kano.guahao.com/hlarge_K5l2953715.jpg","简介：上海市第一人民医院建于1864年3月1日，时称Shanghai General Hospital，为全国当时规模最大的西医医...更多","上海交通大学附属第一人民医院","021-63240090","上海市虹口区海宁路100号","69.4万","None","https://www.guahao.com/hospital/23723714-e925-4149-99ee-f66b0ee36151000"
"6711fcf55f4a555c8ce3ca0c","名医（特需）门诊,内科,外科,骨科,妇产科,儿科,眼科,口腔科,耳鼻喉头颈科,皮肤风湿免疫科,肿瘤科,疼痛科,医学影像科,中医科,麻醉科,全科医疗科,急诊医学科","1.7万","4578","https://kano.guahao.com/hlarge_SB22954573.jpg?timestamp=1478246394832","简介：医院概况新桥医院是第三军医大学第二附属医院，始建于1944年，前身是国民党军政部陆军医院，1950年改编为西南军区总医院，1...更多","重庆新桥医院","023-68755744、023-68755745","重庆市沙坪坝区新桥正街","87.9万","None","https://www.guahao.com/hospital/70e69226-fcde-4c4b-9e0b-05802890863c000"
"6711fcf65f4a555c8ce3ca0e","内科,外科,骨科,妇产科,儿科,皮肤性病科,眼科,耳鼻咽喉头颈科,口腔科,肿瘤科,中医科,不孕不育科,精神科,麻醉科,疼痛科,康复医学科,医学影像科,急诊医学科,体检科,病理科,医学检验科,营养科,重症医学科","2.4万","1631","https://kano.guahao.com/hlarge_6gG2956899.jpg?timestamp=1582888872823","简介：西安交通大学医学院第一附属医院（原西安医科大学第一附属医院）是西北地区最大的综合性三甲医院。现开放床位2300余张，年门诊量...更多","西安交通大学第一附属医院","029-85323112","陕西省西安市雁塔西路277号","1.4万","None","https://www.guahao.com/hospital/986d3ec7-c720-11e1-913c-5cf9dd2e7135000"
"6711fcf75f4a555c8ce3ca10","内科,外科,肿瘤科,中医科,中西医结合科,医学影像科,职业病科","4362","2638","https://kano.guahao.com/hlarge_e0M2954538.jpg","简介：同济大学附属上海市肺科医院(上海市职业病医院)创建于1933年，首任院长为国立上海医学院院长颜福庆教授。建院七十多年来，通过...更多","上海市肺科医院延庆路门诊部","021-65115006","上海市徐汇区延庆路130号","8.1万","None","https://www.guahao.com/hospital/6d6ca698-e799-4fd9-b0c1-8a086f1f134f000"
"6711fcf95f4a555c8ce3ca12","心理咨询,内科,儿科,精神科,麻醉科","2.8万","8374","https://kano.guahao.com/hlarge_e9i2954789.jpg","简介：上海市精神卫生中心又名上海市心理咨询中心，原名上海市精神病防治院，前身为普慈疗养院，始建于1935年。2006年5月上海市精...更多","上海市精神卫生中心","021-64387250","上海市徐汇区宛平南路600号","10.7万","None","https://www.guahao.com/hospital/8296304b-5550-4c20-a434-97e82e19b45e000"
"6711fcfa5f4a555c8ce3ca14","外科,皮肤性病科","1.6万","1445","https://kano.guahao.com/hlarge_uhV2954392.jpg?timestamp=1478246659811","简介：中国医学科学院整形外科医院（八大处整形医院）创建于1957年，是我国最早的整形外科专科医院，是中国整形外科事业的摇篮。医院坐...更多","中国医学科学院整形外科医院","010-88772233,010-85557900","北京市石景山区八大处路33号","4353","None","https://www.guahao.com/hospital/61533eb3-8d00-40e3-8c05-6719d3130570000"
"6711fcfb5f4a555c8ce3ca16","内科,外科,骨科,妇产科,儿科,皮肤性病科,眼科,耳鼻咽喉头颈科,口腔科,肿瘤科,中医科,麻醉科,康复医学科","4832","1447","https://kano.guahao.com/hlarge_lE12953416.jpg","简介：积水潭医院矫形骨科成立于1957年。是北京积水潭医院传统的重点科室之一。自1960年至今，宋献文、郭兴唐、王金城、周乙雄和周...更多","北京积水潭医院新街口院区","010-58516688","北京西城区新街口东街31号","16.9万","None","https://www.guahao.com/hospital/0e27f027-46f5-46a3-bbc1-94c40a2b1133000"
"6711fcfc5f4a555c8ce3ca18","内科,外科,肿瘤科,医学影像科,职业病科,放疗科,耳鼻咽喉头颈科,麻醉科,疼痛科,营养科","7.6万","2.1万","https://kano.guahao.com/hlarge_oE72957388.jpg","简介：同济大学附属上海市肺科医院(上海市职业病医院)创建于1933年，首任院长为国立上海医学院院长颜福庆教授。建院七十多年来，通过...更多","上海市肺科医院","021-65115006","上海市杨浦区政民路507号","110.2万","胸外科","https://www.guahao.com/hospital/a37ef412-f31e-421d-a291-2521ea6f74d8000"
"6711fcfe5f4a555c8ce3ca1a","内科,放疗科,外科,妇科,骨科,肿瘤科,中医科,精神科,麻醉科,医学影像科,病理科,护理门诊,营养科","7374","307","https://kano.guahao.com/hlarge_uHS2956697.jpg","简介：山东省肿瘤医院暨山东省肿瘤防治研究院始建于1958年，坐落于美丽的泉城济南，隶属于山东省医学科学院，山东省卫计委为业务主管部...更多","山东省肿瘤医院","0531-87984777","山东省济南市济兖路440号","2688","骨科,头颈外科","https://www.guahao.com/hospital/986c3710-c720-11e1-913c-5cf9dd2e7135000"
"6711fcff5f4a555c8ce3ca1c","内科,外科,骨科,妇产科,儿科,皮肤性病科,男科,眼科,耳鼻咽喉头颈科,口腔科,肿瘤科,中医科,精神科,麻醉科,疼痛科,康复医学科,医学影像科,急诊医学科,体检科,病理科,医学检验科","5.3万","370","https://kano.guahao.com/hlarge_L6z2958681.jpg","简介：沈阳军区总医院是一所历史悠久、技术力量雄厚，设备先进的大型现代化综合医院，为全军首批三级甲等医院，是东北三省唯一一家经国家人...更多","北部战区总医院","024-28856114","辽宁省沈阳市沈河区文化路83号","5","None","https://www.guahao.com/hospital/FF0153A8EB792010E0430F01A8C07495000"
"6711fd015f4a555c8ce3ca1e","呼吸中心,心脏血管病中心,疼痛诊疗研究中心,内分泌代谢病中心,风湿病诊疗中心,口腔科,内科,外科,中医科,妇科,儿科,男科,医技,专病门诊,美容医疗,骨科,妇产科,皮肤性病科,眼科,耳鼻咽喉头颈科,肿瘤科,中西医结合科,麻醉科,疼痛科,运动医学科,医学影像科,全科医疗科","1.6万","3202","https://kano.guahao.com/hlarge_2VF2956643.jpg?timestamp=1508899850917","简介：中日友好医院（简称\""中日医院\""）位于北京市朝阳区樱花园东街2号，是中华人民共和国国家卫生和计划生育委员会直属医院，于19...更多","中日友好医院","010-84205288","北京市朝阳区樱花园东街","33.4万","None","https://www.guahao.com/hospital/986be850-c720-11e1-913c-5cf9dd2e7135000"
"6711fd085f4a555c8ce3ca20","内科,外科,妇产科,儿科,男科,肿瘤科,中医科,不孕不育科,中西医结合科,精神科,麻醉科,疼痛科,医学影像科,全科医疗科,护理门诊,营养科","1.9万","2517","https://kano.guahao.com/hlarge_zif2958435.jpg","简介：浙江大学医学院附属妇产科医院（浙江省妇女保健院、浙江省妇女医院），是浙江省妇产科医疗、教学、科研及计划生育、妇女保健工作的指...更多","浙江大学医学院附属妇产科医院","0571-87061501","浙江省杭州市学士路1号","3.3万","None","https://www.guahao.com/hospital/ED25EA3F3F65A102E040A8C00F01221B000"
"6711fd095f4a555c8ce3ca22","内科,外科,骨科,肿瘤科,中医科,麻醉科,医学影像科,全科医疗科","2.6万","7391","https://kano.guahao.com/hlarge_gbq2953457.jpg?timestamp=1652084312851","简介：中国人民解放军海军军医大学第三附属医院(东方肝胆外科医院，东方肝胆外科研究所)，是在我国肝胆外科开拓者、著名肝胆外科专家、中...更多","海军军医大学第三附属医院（东方肝胆外科）长海路院区","021-65564166","上海市杨浦区长海路225号","12.0万","None","https://www.guahao.com/hospital/128796908419696000"
"6711fd0b5f4a555c8ce3ca24","外科,内科,特需门诊,特需体检中心,儿科,耳鼻咽喉头颈科,口腔科,医学影像科","4.2万","1.5万","https://kano.guahao.com/hlarge_xEW2957818.jpg","简介：上海市儿童医院是一所集医疗、保健、教学、科研、康复于一体的三级甲等儿童医院，前身是由我国著名儿科专家富文寿及现代儿童营养学创...更多","上海市儿童医院北京西路院区","021-62474880","上海市静安区北京西路1400弄24号","14.2万","None","https://www.guahao.com/hospital/c4f0833d-7f1c-43cc-81e9-1aacc1911b76000"
"6711fd0c5f4a555c8ce3ca26","内科,外科,体检中心,特需门诊,儿科,口腔科,不孕不育科","2.2万","1.5万","https://kano.guahao.com/hlarge_31D2957813.jpg","简介：上海市儿童医院是一所集医疗、保健、教学、科研、康复于一体的三级甲等儿童医院，前身是由我国著名儿科专家富文寿及现代儿童营养学创...更多","上海市儿童医院普陀新院","021-52976020","上海市普陀区泸定路355号,近同普路","7.2万","None","https://www.guahao.com/hospital/c41a8562-f8bb-408c-9d63-75d10a561d46000"
"6711fd0e5f4a555c8ce3ca28","内科,外科,皮肤性病科,中医科,麻醉科,医学影像科,病理科","2.0万","1.2万","https://kano.guahao.com/hlarge_WBP2964806.jpg?timestamp=1534236820396","简介：中国医学科学院皮肤病研究所1954年创建于北京，直属中央卫生部领导。1970年从北京迁至江苏泰州，1984年迁南京现址，并建...更多","中国医学科学院皮肤病医院","025-85478999","中国江苏南京市蒋王庙街12号","2.1万","None","https://www.guahao.com/hospital/986ac934-c720-11e1-913c-5cf9dd2e7135000"
"6711fd0f5f4a555c8ce3ca2a","内科,外科,骨科,儿科,眼科,耳鼻咽喉头颈科,口腔科,中医科,医学影像科","1.9万","1856","https://kano.guahao.com/hlarge_dg92953928.jpg","简介：首都儿科研究所附属儿童医院是三级甲等医院、爱婴医院、北京大学教学医院、规范化服务达标医院、首都平安示范医院。同时也是北京大学...更多","首都儿科研究所附属儿童医院","010-85695555","北京市朝阳区雅宝路2号","65.9万","None","https://www.guahao.com/hospital/3656053a-8313-4ac1-9d6a-5af70382f462000"
"6711fd105f4a555c8ce3ca2c","内科,外科,骨科,妇产科,皮肤性病科,男科,眼科,耳鼻咽喉头颈科,口腔科,肿瘤科,中医科,中西医结合科,不孕不育科,精神科,麻醉科,疼痛科,康复医学科,医学影像科,全科医疗科,急诊医学科,体检科,病理科,医学检验科,护理门诊,营养科","5519","574","https://kano.guahao.com/hlarge_Kxo2956866.jpg","简介：重庆医科大学附属第二医院，是集医疗、教学、科研、预防保健为一体的国家三级甲等综合医院。前身为始建于1892年的“重庆宽仁医院...更多","重庆医科大学附属第二医院(临江门院区)","023-63693000","重庆市临江路76号","2.3万","None","https://www.guahao.com/hospital/986d22e6-c720-11e1-913c-5cf9dd2e7135000"
"6711fd125f4a555c8ce3ca2e","口腔科,病理科","2598","3136","https://kano.guahao.com/hlarge_eXp2959851.jpg?timestamp=1565760364707","简介：武汉大学口腔医院（湖北省口腔医院）位于湖北省武汉市洪山区珞喻路237号，始建于1960年，建筑面积达2.5万平方米，是一所集...更多","武汉大学口腔医院","027-87686110","湖北省武汉市洪山区珞喻路237号","6488","None","https://www.guahao.com/hospital/5257c66d-876b-4b34-98b6-1d34ead2df9c000"
"6711fd135f4a555c8ce3ca30","内科,外科,骨科,妇产科,儿科,皮肤性病科,眼科,耳鼻咽喉头颈科,口腔科,肿瘤科,中医科,中西医结合科,康复医学科,医学影像科,重症医学科","1.5万","212","https://kano.guahao.com/hlarge_BaB2954012.jpg","简介：北京地坛医院（原名北京第一传染病医院）始建于1946年，是卫生部疾病预防与控制中心、北京市卫生局共建单位、三级甲等医院，北京...更多","北京地坛医院","010-84322000","北京市朝阳区京顺东街8号","17.8万","None","https://www.guahao.com/hospital/40ae1865-ad50-452b-bbb2-b356ff7e1ab0000"
"6711fd145f4a555c8ce3ca32","内科,外科,骨科,妇产科,皮肤性病科,眼科,耳鼻咽喉头颈科,口腔科,肿瘤科,中医科,中西医结合科,康复医学科,医学影像科","19","32","https://kano.guahao.com/hlarge_pTb2954272.jpg","简介：首都医科大学附属北京地坛医院始建于1946年，属三级甲等医院，是一所以传染病的诊治、研究和培训任务为特色，并集医疗、教学、科...更多","北京地坛医院顺义院区","010-80400009","北京市顺义区李遂镇南孙路李遂段799号","3","None","https://www.guahao.com/hospital/5726bb15-a985-4093-8380-62404273419f000"
"6711fd1c5f4a555c8ce3ca34","内科,外科,全科医疗科,骨科,妇产科,皮肤性病科,男科,眼科,耳鼻咽喉头颈科,口腔科,肿瘤科,中医科,中西医结合科,精神科,麻醉科,疼痛科,康复医学科,医学影像科,急诊医学科,病理科,护理门诊,营养科","6.0万","7247","https://kano.guahao.com/hlarge_mZu2953451.jpg","简介：复旦大学附属华东医院成立于1951年，其前身为建于1921年的宏恩医院。医院拥有东、南、西、北四幢医疗主楼以及十多幢配套用房...更多","复旦大学附属华东医院","021-62483180","上海市静安区延安西路221号","210.5万","None","https://www.guahao.com/hospital/125369370584301000"
"6711fd1d5f4a555c8ce3ca36","内科,外科,骨科,妇产科,皮肤性病科,男科,眼科,耳鼻咽喉头颈科,口腔科,肿瘤科,中医科,精神科,疼痛科,康复医学科,医学影像科,全科医疗科,病理科,护理门诊,营养科","906","597","https://kano.guahao.com/hlarge_XyS2953999.jpg","简介：复旦大学附属华东医院成立于1951年，其前身为建于1921年的宏恩医院。医院占地面积达4万㎡，拥有东、南、西、北四幢医疗主楼...更多","复旦大学附属华东医院特需诊疗部","021-62483180","上海市静安区延安西路221号","2.0万","None","https://www.guahao.com/hospital/3eded5c6-e446-4c3d-8068-650df181abba000"
"6711fd1e5f4a555c8ce3ca38","内科,外科,骨科,妇产科,皮肤性病科,男科,眼科,耳鼻咽喉头颈科,口腔科,肿瘤科,中医科,中西医结合科,疼痛科,医学影像科,病理科","7143","2785","https://kano.guahao.com/hlarge_h4E2959344.jpg?timestamp=1571015806007","简介：复旦大学附属华东医院成立于1951年，其前身为建于1921年的宏恩医院。医院占地面积达4万㎡，拥有东、南、西、北四幢医疗主楼...更多","复旦大学附属华东医院闵行门诊部","021-62483180","上海市闵行区春申路2869号,近莲花南路","12.4万","None","https://www.guahao.com/hospital/127529327571445000"
"6711fd1f5f4a555c8ce3ca3a","放射治疗科,内科,外科,妇产科,肿瘤科,中医科,中西医结合科,疼痛科,医学影像科,体检科,病理科,医学检验科","6169","751","https://kano.guahao.com/hlarge_Ad42954281.jpg","简介：浙江省肿瘤医院于1963年10月成立，是国内最早成立的4家肿瘤医院之一、省内第一家肿瘤专科医院。 医院现有职工1287人，高...更多","浙江省肿瘤医院","0571-88122221","浙江省杭州市拱墅区半山桥广济路38号","4395","None","https://www.guahao.com/hospital/580988fd-e0ec-4670-aa69-1cc3a35c4ca9000"
"6711fd215f4a555c8ce3ca3c","内科,妇产科,儿科,眼科,口腔科,肿瘤科,中医科,不孕不育科,精神科,麻醉科,康复医学科,医学影像科,医学检验科,营养科,重症医学科","1.4万","2543","https://kano.guahao.com/hlarge_y8d2956796.jpg","简介：广州市儿童医院1953年8月1日正式成立，前身为达·保罗医院。经过50多年的发展，我院已成为国内较有影响的儿童医院之一，是一...更多","广州市妇女儿童医疗中心","020-81886332","人民中路318号","0","None","https://www.guahao.com/hospital/986cb09c-c720-11e1-913c-5cf9dd2e7135000"
"6711fd225f4a555c8ce3ca3e","内科,外科,骨科,妇产科,儿科,皮肤性病科,男科,眼科,耳鼻咽喉头颈科,口腔科,肿瘤科,中医科,不孕不育科,精神科,疼痛科,康复医学科,医学影像科,急诊医学科,病理科,重症医学科","1.2万","803","https://kano.guahao.com/hlarge_d0e2956955.jpg","简介：1939年，""一附院""以一个小门诊部发韧于""南昌沦陷与抗战反攻""的苦难年代，为民族的存亡而生死救援。1945年抗战胜利，成为...更多","南昌大学第一附属医院","0791-88692748","江西省南昌市东湖区永外正街17号","0","None","https://www.guahao.com/hospital/986d77cb-c720-11e1-913c-5cf9dd2e7135000"
"6711fd245f4a555c8ce3ca40","内科,外科,骨科,妇产科,儿科,皮肤性病科,男科,眼科,耳鼻咽喉头颈科,口腔科,肿瘤科,中医科,中西医结合科,精神科,麻醉科,疼痛科,康复医学科,医学影像科,全科医疗科,急诊医学科,体检科,病理科,营养科","5.5万","225","https://kano.guahao.com/hlarge_rfb2956909.jpg","简介：1973年天津第二附属医院在原河北省医院旧址成立，1994年8月，随着天津医学院成为天津医科大学而更名为天津医科大学第二医院...更多","天津医科大学第二医院","022-28331788","天津市河西区平江道23号","7","None","https://www.guahao.com/hospital/986d4f39-c720-11e1-913c-5cf9dd2e7135000"
"6711fd255f4a555c8ce3ca42","内科,外科,骨科,妇产科,儿科,皮肤性病科,耳鼻咽喉头颈科,肿瘤科,中医科,麻醉科,医学影像科","738","234","https://kano.guahao.com/hlarge_7P656696016.jpg","简介：哈尔滨医科大学附属肿瘤医院（哈医大三院、黑龙江省肿瘤医院）始建于1972年，是我省唯一集肿瘤预防、医疗、教学、科研为一体的三...更多","哈尔滨医科大学附属肿瘤医院","0451-86298000","哈平路150号","25","None","https://www.guahao.com/hospital/986d5d0a-c720-11e1-913c-5cf9dd2e7135000"
"6711fd265f4a555c8ce3ca44","内科,外科,骨科,妇产科,儿科,皮肤性病科,男科,眼科,耳鼻咽喉头颈科,口腔科,肿瘤科,中医科,精神科,麻醉科,疼痛科,康复医学科,医学影像科,全科医疗科,急诊医学科,病理科,营养科,重症医学科","1.8万","1391","https://kano.guahao.com/hlarge_HMW2957315.jpg","简介：南京市第一医院，又名南京医科大学附属南京医院、南京医科大学第三临床医学院、南京市心血管病医院，创办于1936年2月1日。19...更多","南京市第一医院","025-52271000（总机）","南京市长乐路68号","4.6万","None","https://www.guahao.com/hospital/9b5f86a4-ca22-4c29-96eb-59dfb21c70ca000"
"6711fd275f4a555c8ce3ca46","","0","0","https://kano.guahao.com/hlarge_z3W27810824","简介：暂无","北京朝阳光华医院","010-65086972","北京市朝阳区朝阳路新街大院18号","0","None","https://www.guahao.com/hospital/d4c07b28-731a-4967-8fad-03416e24690a000"
"6711fd2d5f4a555c8ce3ca48","","0","0","https://kano.guahao.com/hlarge_z3W27810824","简介：暂无","北京市二零一所医院","010-68963221","北京市朝阳区豆各庄乡","0","None","https://www.guahao.com/hospital/644aab6d-ca7a-4ac4-9975-c23dbb1abc8c000"
"6711fd2e5f4a555c8ce3ca4a","","0","0","https://kano.guahao.com/hlarge_z3W27810824","简介：暂无","北京朝阳凌和望京医院","010-84710230，84710213","北京市朝阳区宏昌路望京西园一区120号","0","None","https://www.guahao.com/hospital/96a3f50a-8b00-48ea-ba58-52702f2fbcdf000"
"6711fd2f5f4a555c8ce3ca4c","","0","0","https://kano.guahao.com/hlarge_z3W27810824","简介：暂无","新市镇卫生院","","广东新市镇卫生院","0","None","https://www.guahao.com/hospital/bd31fd4c-c244-4fa1-8d9d-3c3531fdd1bf000"
"6711fd305f4a555c8ce3ca4e","","0","0","https://kano.guahao.com/hlarge_z3W27810824","简介：暂无","乌鲁木齐市米东区卡子湾社区卫生服务中心育林社区卫生服务站","","乌鲁木齐市米东区卡子湾育林社区卫生服务站","0","None","https://www.guahao.com/hospital/013e1692-82b5-4ae6-af79-7d40cf031a8d000"
"6711fd315f4a555c8ce3ca50","","0","0","https://kano.guahao.com/hlarge_drv123345407.jpg?timestamp=1565887646640","简介：暂无","乌鲁木齐市米东区卡子湾社区服务中心佳园社区卫生服务站","","乌鲁木齐市米东区卡子湾社区服务中心佳园卫生服务站","0","None","https://www.guahao.com/hospital/2a6e9df5-6dd9-4147-992f-199bdbdf20fd000"
"6711fd325f4a555c8ce3ca52","","0","0","https://kano.guahao.com/hlarge_F6e123357782.jpg?timestamp=1565889304328","简介：暂无","乌鲁木齐市米东区三道坝镇三道坝村卫生室","","乌鲁木齐市米东区三道坝镇三道坝村卫生室","0","None","https://www.guahao.com/hospital/2d2ff193-35d9-4c2d-b007-41dff67ef744000"
