"_id","departments","evaluation","followers","img_url","intro","name","phone_number","position","reservation","special","url"
"6711fc445f4a555c8ce3c96c","内科,外科,骨科,妇产科,儿科,皮肤性病科,男科,眼科,耳鼻咽喉头颈科,口腔科,肿瘤科,中医科,不孕不育科,精神科,麻醉科,疼痛科,康复医学科,医学影像科,急诊医学科,病理科,营养科,重症医学科","2.9万","2.0万","https://kano.guahao.com/hlarge_Gnr2953583.jpg","简介：北京协和医院是集医疗、教学、科研于一体的现代化综合三级甲等医院，是国家卫生健康委指定的全国疑难重症诊治指导中心，最早承担高干...更多","北京协和医院","010-69156114","北京市东城区帅府园一号","96.9万","None","https://www.guahao.com/hospital/17634310-b567-4d21-8a02-20dc15e90da5000"
"6711fc455f4a555c8ce3c96e","内科,外科,骨科,妇产科,儿科,皮肤性病科,眼科,耳鼻咽喉头颈科,肿瘤科,中医科,不孕不育科,中西医结合科,精神科,麻醉科,疼痛科,康复医学科,医学影像科,全科医疗科,病理科,医学检验科,护理门诊,营养科,重症医学科","2.7万","6075","https://kano.guahao.com/hlarge_jHG2956808.jpg","简介：在中国历史文化名城成都市，锦江万里桥头的华西坝，有一座闻名遐迩的医学城，她就是四川大学华西临床医学院/华西医院。追溯历史，华...更多","四川大学华西医院","028-85422286","四川省成都市武侯区国学巷37号","256","None","https://www.guahao.com/hospital/986c9a70-c720-11e1-913c-5cf9dd2e7135000"
"6711fc465f4a555c8ce3c970","内科,外科,骨科,妇产科,儿科,皮肤性病科,男科,眼科,耳鼻咽喉头颈科,口腔科,肿瘤科,中医科,精神科,麻醉科,疼痛科,康复医学科,医学影像科,全科医疗科,急诊医学科,病理科,营养科","17.9万","7.3万","https://kano.guahao.com/hlarge_c7m2954342.jpg","简介：解放军总医院是全军规模最大的综合性医院，集医疗、保健、教学、科研于一体，是国家重要保健基地之一，负责中央、军委和总部的医疗保...更多","中国人民解放军总医院301医院","010-68182255","北京市海淀区复兴路28号","227.0万","骨科,内分泌科,耳鼻咽喉头颈外科,肾脏病科","https://www.guahao.com/hospital/5cee04f9-4cc8-4499-a35b-6f37f2dd8a74000"
"6711fc485f4a555c8ce3c972","内科,外科,骨科,妇产科,儿科,皮肤性病科,男科,眼科,耳鼻咽喉头颈科,口腔科,肿瘤科,中医科,不孕不育科,精神科,麻醉科,疼痛科,康复医学科,医学影像科,全科医疗科,急诊医学科,病理科,护理门诊,营养科","16.5万","9.9万","https://kano.guahao.com/hlarge_HaT2958119.jpg","简介：上海交通大学医学院附属瑞金医院(上海瑞金医院)建于1907年，原名广慈医院，是一所三级甲等大型综合性教学医院。医院占地面积1...更多","上海交通大学医学院附属瑞金医院","021-64370045","上海市黄浦区瑞金二路197号","220.4万","门诊肾脏,门诊血液,门诊内分泌","https://www.guahao.com/hospital/dde98fc9-4183-48ee-8c84-453058fa7fe3000"
"6711fc4a5f4a555c8ce3c974","内科,外科,骨科,妇产科,儿科,皮肤性病科,男科,眼科,耳鼻咽喉头颈科,肿瘤科,中医科,精神科,麻醉科,疼痛科,康复医学科,医学影像科,急诊医学科,病理科,医学检验科,护理门诊,营养科","7.3万","3713","https://kano.guahao.com/hlarge_7hZ2956781.jpg","简介：中外知名的西京医院坐落在美丽的古城西安，其前身是延安抗战烽火岁月里诞生的中央医院，1954年与原第五军医大学附属医院合并，为...更多","西京医院","029-88886666","陕西省西安市长乐西路15号","39","None","https://www.guahao.com/hospital/986c8a85-c720-11e1-913c-5cf9dd2e7135000"
"6711fc4b5f4a555c8ce3c976","重症医学科,变态反应科,内科,外科,骨科,皮肤性病科,眼科,耳鼻咽喉头颈科,口腔科,肿瘤科,中医科,精神科,疼痛科,康复医学科,运动医学科,医学影像科,全科医疗科,病理科,护理门诊,营养科","55.7万","14.9万","https://kano.guahao.com/hlarge_aZ02953450.jpg?timestamp=1479099468402","简介：复旦大学附属华山医院创建于1907年，是复旦大学附属综合性教学医院和中国红十字会直属医院，1992年首批通过国家三级甲等医院...更多","复旦大学附属华山医院","021-52889999","上海市静安区乌鲁木齐中路12号","505.0万","皮肤科,神经内科,神经外科,感染发热,抗生素研究所","https://www.guahao.com/hospital/125336754304601000"
"6711fc4d5f4a555c8ce3c978","内科,外科,骨科,妇产科,皮肤性病科,眼科,耳鼻咽喉头颈科,口腔科,肿瘤科,中西医结合科,精神科,康复医学科,运动医学科,医学影像科,护理门诊","3.0万","3.4万","https://kano.guahao.com/hlarge_jyk2958614.jpg","简介：复旦大学附属华山医院浦东院区（上海国际医院）坐落在浦东金桥地区，毗邻碧云国际社区，距浦东国际机场25公里，陆家嘴金融服务区1...更多","复旦大学附属华山医院浦东院区","021-38719999","上海市浦东新区红枫路525号","40.9万","None","https://www.guahao.com/hospital/fb60b555-d22d-4229-b79c-ce9e96c82863000"
"6711fc4e5f4a555c8ce3c97a","专病门诊,内科,外科,骨科,妇产科,儿科,皮肤性病科,眼科,耳鼻咽喉头颈科,口腔科,肿瘤科,中医科,中西医结合科,精神科,麻醉科,康复医学科,运动医学科,医学影像科,重症医学科","2.0万","2.8万","https://kano.guahao.com/hlarge_ERJ2958122.jpg","简介：复旦大学附属华山医院北院于2012年12月18日试运行，是一家按上海市区域卫生规划设置的，集医、教、研于一体的三级甲等综合性...更多","上海华山医院宝山院区（原华山北院）","021-66895999","上海市宝山区陆翔路108号","43.5万","便民核酸检测","https://www.guahao.com/hospital/DD5E1CC4E11B1016E0400A0AC8642080000"
"6711fc4f5f4a555c8ce3c97c","内科,儿科,眼科,肿瘤科,中医科,康复医学科","887","73","https://kano.guahao.com/hlarge_GzZ2957193.jpg","简介：复旦大学附属华山医院永和分院位于闸北区交城路100号，其前身为上海市闸北区彭浦永和地段医院。2001年10月，根据复旦大学附...更多","复旦大学附属华山医院永和分院","021-56505528","上海市交城路100号","0","None","https://www.guahao.com/hospital/9a996484-c720-11e1-913c-5cf9dd2e7135000"
"6711fc505f4a555c8ce3c97e","内科,外科,骨科,妇产科,儿科,皮肤性病科,眼科,耳鼻咽喉头颈科,口腔科,肿瘤科,康复医学科,医学影像科,病理科,医学检验科","6936","522","https://kano.guahao.com/hlarge_c942955569.jpg","简介：华山医院宝山分院位于宝山区长江西路1999号，是宝山区政府投资1.4亿元新建的二级综合性医院。2006年10月，区委、区政府...更多","复旦大学附属华山医院宝山分院","021-56731199","上海市宝山区长江西路1999号","0","None","https://www.guahao.com/hospital/98683f53-c720-11e1-913c-5cf9dd2e7135000"
"6711fc585f4a555c8ce3c980","多学科MDT门诊,妇科肿瘤,内科,外科,骨科,妇产科,皮肤性病科,眼科,耳鼻咽喉头颈科,口腔科,肿瘤科,中医科,中西医结合科,不孕不育科,精神科,麻醉科,疼痛科,康复医学科,医学影像科,全科医疗科,急诊医学科,体检科,病理科,营养科","29.5万","11.5万","https://kano.guahao.com/hlarge_ezs2953466.jpg?timestamp=1475133694670","简介：复旦大学附属中山医院是卫生部部属综合性教学医院。医院开业于1937年，是当时中国人管理的第一所大型综合性医院，隶属于国立上海...更多","复旦大学附属中山医院","021-64041990","上海市徐汇区枫林路180号","503.3万","心内科,心内科高级专家门诊,普外科,呼吸内科,呼吸内科高级专家门诊,胸外科,胸外科高级专家门诊,心外科,心外科高级专家门诊","https://www.guahao.com/hospital/125336070937502000"
"6711fc595f4a555c8ce3c982","消化内科,内科,外科,骨科,妇产科,儿科,皮肤性病科,眼科,耳鼻咽喉头颈科,口腔科,肿瘤科,中医科,麻醉科,疼痛科,康复医学科,医学影像科","629","861","https://kano.guahao.com/hlarge_EQk2955985.jpg","简介：医院始创于1948年，前身为中国红十字会青浦分会医院，1994年通过卫生部二级甲等医院评审，2012年通过上海市三级综合医院...更多","复旦大学附属中山医院青浦分院","021-69719190","上海市青浦区公园东路1158号","1553","None","https://www.guahao.com/hospital/98698b47-c720-11e1-913c-5cf9dd2e7135000"
"6711fc5c5f4a555c8ce3c984","内科,外科,妇产科,生殖中心,儿科,感染科,中西医结合科,中医科,中医妇科,神经内科,急诊内科,急诊科,急诊外科,肿瘤科,耳鼻咽喉-头颈外科,眼科,皮肤病与性病科,口腔科,过敏反应科,放射科,疼痛门诊,康复医学科,核医学科,临床营养科,知名专家门诊,综合专家门诊,专病门诊,病理专科,方便门诊,骨科,皮肤性病科,耳鼻咽喉头颈科,不孕不育科,疼痛科,医学影像科,全科医疗科","11.5万","7.4万","https://kano.guahao.com/hlarge_auK314880124.jpg?timestamp=1675327690052","简介：长江之滨，黄鹤楼下，有一所海内外闻名遐迩的医院，她就是华中科技大学同济医学院附属同济医院。  　　同济医院1900年由德国医...更多","华中科技大学同济医学院附属同济医院","027-83662688","湖北省武汉市解放大道1095号","279.0万","None","https://www.guahao.com/hospital/60cd2663-d69d-4f63-bc17-8618d6e5e609000"
"6711fc5d5f4a555c8ce3c986","内科,外科,骨科,妇产科,儿科,皮肤性病科,男科,眼科,耳鼻咽喉头颈科,口腔科,肿瘤科,中医科,不孕不育科,精神科,麻醉科,康复医学科,医学影像科,急诊医学科,体检科,医学检验科,营养科,重症医学科","3028","4689","https://kano.guahao.com/hlarge_P4y2956791.jpg","简介：中山一院（中山大学附属第一医院）前身是广东公医医科专门学校附设公立医院，始建于1910年，1957 年命名为中山医学院附属第...更多","中山大学附属第一医院","020-87330808","广东省广州市中山二路58号","0","None","https://www.guahao.com/hospital/986ca741-c720-11e1-913c-5cf9dd2e7135000"
"6711fc5e5f4a555c8ce3c988","内科,外科,骨科,妇产科,儿科,皮肤性病科,眼科,耳鼻咽喉头颈科,口腔科,中医科,麻醉科,康复医学科,医学影像科,急诊医学科,病理科","44","2317","https://kano.guahao.com/hlarge_RUZ2955200.jpg","简介：中山大学附属第一医院黄埔院区，是中山大学附属第一医院设在广州市黄埔区的一个院区，位于广州市黄埔区黄埔东路183号。黄埔院区目...更多","中山大学附属第一医院东院","020-82377155","广东省广州市黄埔区黄埔东路183号","0","None","https://www.guahao.com/hospital/9867366d-c720-11e1-913c-5cf9dd2e7135000"
"6711fc5f5f4a555c8ce3c98a","内科,外科,骨科,妇产科,儿科,皮肤性病科,眼科,耳鼻咽喉头颈科,口腔科,肿瘤科,中医科,疼痛科,康复医学科,医学影像科","2","73","https://kano.guahao.com/hlarge_Jn52955234.jpg","简介：中山大学附属第一医院东山院区（原东山区人民医院）创建于1917年，通过几十年的建设和发展，成为一家科室设置齐全、诊疗功能完善...更多","中山大学附属第一医院东山院区","020-62732233","广东省广州市东山区中山二路1号","0","None","https://www.guahao.com/hospital/98674e4a-c720-11e1-913c-5cf9dd2e7135000"
"6711fc615f4a555c8ce3c98c","小儿肾内科,内科,外科,骨科,妇产科,儿科,皮肤性病科,男科,眼科,耳鼻咽喉头颈科,口腔科,肿瘤科,中西医结合科,不孕不育科,精神科,麻醉科,疼痛科,康复医学科,医学影像科,全科医疗科,急诊医学科,营养科","2.2万","4665","https://kano.guahao.com/hlarge_mNP2953930.jpg","简介：北大医院是北京大学第一医院的简称，是一所融医疗、教学、科研、预防为一体的大型三甲综合性医院。院区分为：北大医院(西城区西什库...更多","北京大学第一医院","010-83572211","北京市西城区西什库大街八号","5715","None","https://www.guahao.com/hospital/384b93f5-e9f8-448e-8635-56ffea47f661000"
"6711fc625f4a555c8ce3c98e","内科,外科,骨科,妇产科,儿科,皮肤性病科,男科,眼科,耳鼻咽喉头颈科,口腔科,肿瘤科,中医科,不孕不育科,精神科,麻醉科,疼痛科,康复医学科,运动医学科,医学影像科,全科医疗科,职业病科,急诊医学科","2.0万","5343","https://kano.guahao.com/hlarge_41e2953873.jpg?timestamp=1624354772987","简介：北京大学第三医院(简称北医三院)始建于1958年，是集医疗、教学、科研和预防保健为一体的现代化综合性三级甲等医院。截止至20...更多","北京大学第三医院","010-82266699","北京市海淀区花园北路49号","650","None","https://www.guahao.com/hospital/33be00f1-4fae-4549-a101-fa2bf2582915000"
"6711fc635f4a555c8ce3c990","内科,外科,骨科,妇产科,儿科,皮肤性病科,眼科,耳鼻咽喉头颈科,肿瘤科,中医科,精神科,麻醉科,疼痛科,康复医学科,运动医学科,医学影像科,全科医疗科,病理科","4.1万","6466","https://kano.guahao.com/hlarge_AmP2954098.jpg","简介：中国医科大学附属第一医院是国内一所大型综合性三级甲等医院，也是一座具有光荣革命传统的医院。      中国医大一院诞生在二十...更多","中国医科大学附属第一医院","024-83283333","辽宁省沈阳市和平区南京北街155号","155","胰胆外科","https://www.guahao.com/hospital/47f4be3b-725b-420c-8e78-7862ab427848000"
"6711fc655f4a555c8ce3c992","特需门诊,内科,外科,妇产科,儿科,传染科,内分泌科,精神科,医学心理学,心血管外科,胸外科,神经内科,神经外科,老年科,眼科,耳鼻喉科,口腔科,微创外科,皮肤科,康复科,肿瘤科,中医科,麻醉科,药学部,放射科,核医学科,营养科,专科护理门诊,专家门诊,不孕不育科,中西医结合科,疼痛科,医学影像科,全科医疗科,急诊医学科,医学检验科","2.6万","2.0万","https://kano.guahao.com/hlarge_FE42954341.jpg","简介：中南大学湘雅二医院(原湖南医科大学附属第二医院)位于历史名城湖南省会长沙，脱胎于1906年美国雅礼协会在中国创办最早的西医院...更多","中南大学湘雅二医院","0731-85295888","湖南省长沙市人民中路139号","32.1万","None","https://www.guahao.com/hospital/5d04ae45-d4f9-42d8-a7f2-8f25897e197d000"
"6711fc6e5f4a555c8ce3c994","惠侨门诊,专科,内科,外科,骨科,妇产科,儿科,皮肤性病科,眼科,耳鼻咽喉头颈科,口腔科,肿瘤科,中医科,不孕不育科,麻醉科,康复医学科,医学影像科,全科医疗科,急诊医学科,病理科,医学检验科,重症医学科","3.1万","6138","https://kano.guahao.com/hlarge_UDe2957469.jpg","简介：南方医院系南方医科大学（原第一军医大学）第一附属医院、第一临床医学院，是一所集医疗、教学、科研和预防保健为一体的大型综合性三...更多","南方医科大学南方医院","020-61641114","广东省广州市广州大道北路1838号","10.1万","None","https://www.guahao.com/hospital/a986c8d76-c720-11e1-913c-5cf9dd2e7135000"
"6711fc705f4a555c8ce3c996","康复医学科,精神科,内科,外科,骨科,妇产科,皮肤性病科,男科,眼科,耳鼻咽喉头颈科,口腔科,肿瘤科,中医科,不孕不育科,麻醉科,疼痛科,医学影像科,全科医疗科,护理门诊,营养科","9.5万","4.0万","https://kano.guahao.com/hlarge_3eB2954374.jpg","简介：上海交大医学院附属仁济医院建于1844年，是上海开埠后第一所西医医院，迄今已有161年的历史，她是中国最早的综合性西医医院之...更多","上海交通大学医学院附属仁济医院东院","021-58752345","上海市浦东新浦建路160号","129.4万","消化科,风湿病科","https://www.guahao.com/hospital/5f97d681-0528-40ac-8e43-a4db5cac6c7f000"
"6711fc725f4a555c8ce3c998","特种医学与军事医学科,内科,外科,骨科,妇产科,儿科,皮肤性病科,男科,眼科,耳鼻咽喉头颈科,口腔科,肿瘤科,中医科,不孕不育科,精神科,麻醉科,疼痛科,康复医学科,医学影像科,体检科,营养科","5.6万","1.7万","https://kano.guahao.com/hlarge_BKV2957384.jpg","简介：仁济医院建于1844年，是上海开埠后第一所西医医院，迄今已有160多年的历史。仁济医院是一个学科门类齐全，集医疗、教学、科研...更多","上海交通大学医学院附属仁济医院西院","021-63261796","上海市黄浦区山东中路145号","51.9万","消化科,风湿病科","https://www.guahao.com/hospital/a315e171-061f-420a-8e17-557ea0cbbae5000"
"6711fc745f4a555c8ce3c99a","内科,外科,骨科,妇产科,儿科,皮肤性病科,男科,眼科,耳鼻咽喉头颈科,口腔科,肿瘤科,中医科,麻醉科,疼痛科,医学影像科,急诊医学科,病理科,营养科,重症医学科","3.0万","6906","https://kano.guahao.com/hlarge_WlN2954770.jpg?timestamp=1583388599400","简介：仁济医院建于1844 年，是上海开埠后第一所西医医院。医院目前由东西南北四个院区和上海市肿瘤研究所组成，是一个学科门类齐全，...更多","上海交通大学医学院附属仁济医院南院","021-58752345","上海市闵行区浦江镇江月路2000号","20.2万","None","https://www.guahao.com/hospital/8294552e-1521-45e9-bac0-5de1a5de6f39000"
"6711fc755f4a555c8ce3c99c","内科,外科,骨科,妇产科,儿科,皮肤性病科,男科,眼科,耳鼻咽喉头颈科,口腔科,肿瘤科,中医科,不孕不育科,精神科,麻醉科,疼痛科,康复医学科,医学影像科,全科医疗科,急诊医学科,病理科,护理门诊,营养科,重症医学科","2.5万","1762","https://kano.guahao.com/hlarge_Yb32958430.jpg","简介：1947年11月，浙江大学竺可桢校长远见卓识，运筹于胸，宏图甫展，购置了田家园6号、9号民宅作为医院用房，面积约2770平米...更多","浙江大学医学院附属第一医院","0571-87236666","浙江省杭州市庆春路79号(310003)","917","None","https://www.guahao.com/hospital/ED25EA3F3F67A102E040A8C00F01221B000"
"6711fc775f4a555c8ce3c99e","中医医院,内科,外科,骨科,妇产科,儿科,皮肤性病科,眼科,耳鼻咽喉头颈科,口腔科,肿瘤科,中医科,不孕不育科,麻醉科,疼痛科,康复医学科,医学影像科,全科医疗科,急诊医学科,病理科,营养科","9.1万","3.3万","https://kano.guahao.com/hlarge_KK82954913.jpg","简介：第二军医大学附属长海医院创建于1949年，是一所集医疗、教学、科研为一体的现代化大型综合性医院。1993年首批评为三级甲等医...更多","上海长海医院","021-31166666","上海市杨浦区长海路168号","134.2万","消化内科,前列腺肿瘤联席特需门诊,泌尿外科","https://www.guahao.com/hospital/8f113a19-eee7-47b8-9517-2ad069a2f57a000"
"6711fc795f4a555c8ce3c9a0","内科,外科,妇产科,骨科,儿科,感染科,中医科,眼科,口腔科,皮肤科,名医门诊,内分泌科,整形美容外科,专病专科,国际门诊,健康管理,协和肿瘤中心,男科,耳鼻咽喉头颈科,肿瘤科,中西医结合科,不孕不育科,麻醉科,疼痛科,康复医学科,医学影像科,全科医疗科,急诊医学科,体检科,病理科,护理门诊","8.8万","7.5万","https://kano.guahao.com/hlarge_ao32959867.jpg?timestamp=1589878785175","简介：武汉协和医院历史悠久，创建于1866年，是近150年来一直扎根于湖北的国家综合性教学医院，是国内的顶级医疗机构之一。    ...更多","华中科技大学同济医学院附属协和医院","027-85726114","湖北省武汉市江汉区解放大道1277号","212.5万","None","https://www.guahao.com/hospital/22fbe56c-13e2-4e34-9cee-24ab874b6b9c000"
"6711fc7a5f4a555c8ce3c9a2","外科,放射治疗科,肿瘤内科,专病专科（普通门诊）,中医科,医学影像科,超声诊断科,肿瘤科,病理科,营养科","23.2万","5.1万","https://kano.guahao.com/hlarge_XTh2953449.jpg?timestamp=1475133657657","简介：复旦大学附属肿瘤医院是国家卫生部直属的，集医疗、教学、科研、预防为一体的三级甲等肿瘤专科医院，其前身是中比镭锭治疗院，于19...更多","复旦大学附属肿瘤医院徐汇院区","021-64175590","上海市徐汇区东安路270号","322.0万","None","https://www.guahao.com/hospital/125358368239002000"
"6711fc7b5f4a555c8ce3c9a4","肿瘤外科,肿瘤妇科,肿瘤放疗,PICC护理,专病门诊,多学科,肿瘤内科,外科,中西医结合科,医学影像科","1637","719","https://kano.guahao.com/hlarge_YBw2954868.jpg?timestamp=1598513871253","简介：复旦大学附属肿瘤医院闵行分院（上海市闵行区肿瘤医院）是复旦大学与闵行区政府联手组建的，于2006年12月1日正式挂牌成立。医...更多","复旦大学附属肿瘤医院闵行分院","021-64629290","上海市闵行区瑞丽路106号","1.1万","None","https://www.guahao.com/hospital/8b9ecbce-844f-46f8-86df-d89e9a2da070000"
"6711fc7d5f4a555c8ce3c9a6","整复外科,口腔科,眼科,骨科,儿科,耳鼻咽喉头颈外科,放疗科,康复医学科,辅助生殖科,妇产科,激光美容科,麻醉科,内科,皮肤科,全科医学科,外科,医学影像科,营养科,中医科,肿瘤科,耳鼻咽喉头颈科,疼痛科,全科医疗科,急诊医学科,病理科,护理门诊","16.5万","10.9万","https://kano.guahao.com/hlarge_cbv2953376.jpg?timestamp=1476324370800","简介：上海交通大学医学院附属第九人民医院（Shanghai Ninth People’s Hospital, Shanghai J...更多","上海交通大学医学院附属第九人民医院（南部院区）","021-23271699","上海市黄浦区瞿溪路500号","324.2万","None","https://www.guahao.com/hospital/0ba4a4af-6a09-47ef-8bc6-6ecd1a7d3bb4000"
"6711fc875f4a555c8ce3c9a8","专家门诊,国际医疗部,内科,外科,骨科,妇产科,儿科,皮肤科,眼科,耳鼻咽喉科,口腔科,不孕不育科,中西医结合科,健康管理中心,康复医学科,心理卫生中心,麻醉科,运动医学科,医学影像科,全科医学科,病理科,护理门诊,营养科,药剂科,肿瘤科,急诊医学科,重症医学科","11.6万","5.1万","https://kano.guahao.com/hlarge_yHn2954071.jpg","简介：湘雅医院位于文化名城长沙，始建于1906年，由美国耶鲁大学（Yale University）雅礼协会（Yale Missio...更多","中南大学湘雅医院","0731-84328888","湖南省长沙市湘雅路87号","236.9万","专家门诊","https://www.guahao.com/hospital/448f9a19-8cd2-4ccf-a152-3930ec622d9f000"
"6711fc885f4a555c8ce3c9aa","内科,外科,骨科,妇产科,儿科,皮肤性病科,眼科,耳鼻咽喉头颈科,口腔科,肿瘤科,中医科,中西医结合科,不孕不育科,精神科,麻醉科,疼痛科,康复医学科,医学影像科,全科医疗科,职业病科,急诊医学科,病理科,医学检验科,护理门诊,重症医学科,预防保健科","3.1万","682","https://kano.guahao.com/hlarge_nUx2956872.jpg","简介：山东大学齐鲁医院是山东大学直属的国家卫生部直管医院。它坐落于泉城济南风景秀丽的趵突泉畔，是集医疗、教学、科研和预防保健于一体...更多","山东大学齐鲁医院","0531-82169114","山东省济南市文化西路107号","0","None","https://www.guahao.com/hospital/986d12c9-c720-11e1-913c-5cf9dd2e7135000"
"6711fc8a5f4a555c8ce3c9ac","内科,外科,骨科,妇产科,儿科,皮肤性病科,男科,眼科,耳鼻咽喉头颈科,口腔科,肿瘤科,中医科,不孕不育科,精神科,麻醉科,疼痛科,康复医学科,运动医学科,医学影像科,全科医疗科,体检科,病理科,护理门诊,营养科,预防保健科","4.4万","1.6万","https://kano.guahao.com/hlarge_9zk2953504.jpg","简介：江苏省人民医院，暨南京医科大学第一附属医院、江苏省临床医学研究院、江苏省红十字医院。其前身是1936年成立的江苏省立医政学院...更多","江苏省人民医院","025-83714511,83718836","本院：江苏南京广州路300号，河西院区（省妇幼）：江东北路368号","6.6万","None","https://www.guahao.com/hospital/138716556639136000"
"6711fc8b5f4a555c8ce3c9ae","小儿心脏科,内科,外科,骨科,妇产科,儿科,皮肤性病科,眼科,耳鼻咽喉头颈科,口腔科,中医科,精神科,麻醉科,疼痛科,医学影像科,全科医疗科,急诊医学科,重症医学科","1.2万","3547","https://kano.guahao.com/hlarge_qOF2954772.jpg","简介：首都医科大学附属北京安贞医院集医疗、教学、科研、预防、国际交流五位一体，是以治疗心肺血管疾病为重点的三级甲等综合性医院，在全...更多","首都医科大学附属北京安贞医院","010-64456413","北京市朝阳区安贞路2号","116.6万","小儿心脏中心特需门诊,心脏内科中心","https://www.guahao.com/hospital/82e2981c-9b46-4fe0-affc-c52109994fd5000"
"6711fc8c5f4a555c8ce3c9b0","内科,外科,骨科,妇产科,儿科,皮肤性病科,男科,眼科,耳鼻咽喉头颈科,口腔科,肿瘤科,中医科,不孕不育科,中西医结合科,精神科,麻醉科,疼痛科,康复医学科,医学影像科,急诊医学科,病理科,医学检验科,营养科,重症医学科","3.4万","934","https://kano.guahao.com/hlarge_MQv2956799.jpg","简介：中国医科大学附属盛京医院是一所现代化大型综合性、数字化大学附属医院。医院南湖院区位于沈阳市和平区三好街，滑翔院区位于沈阳市铁...更多","中国医科大学附属盛京医院南湖院区","024-23921565","辽宁省沈阳市和平区三好街36号","22","None","https://www.guahao.com/hospital/986cb7e8-c720-11e1-913c-5cf9dd2e7135000"
